{
  "id": "worldinfo.buffer.score",
  "domain": "worldinfo",
  "title": "扫描缓冲的构造（哨兵字符 + 名字前缀）与 getScore 的加权规则",
  "priority": "P0",
  "authority": "src",
  "spec": {
    "缓冲的四块文本": [
      { "块": "深度缓冲", "内容": "聊天消息（已 trim），**下标 = 深度，0 是最新一条**" },
      { "块": "递归缓冲", "内容": "递归激活条目正文的累积" },
      { "块": "注入缓冲", "内容": "声明了「参与扫描」的扩展提示词" },
      { "块": "全局扫描数据", "内容": "人物设定 / 角色描述等，按条目的 match* 开关选择性拼接" }
    ],
    "构造深度缓冲的两个硬规则": [
      "深度 0 = 最新消息，由调用方在传进来之前就**反转**数组实现。",
      "**「名字: 」前缀也在调用方那一行加好**（当全局「扫描含名字」开着时），缓冲内部不再补前缀。且调用方已先剔除系统消息。",
      "构造上限 1000 条（超过不再读）；遇到最后一条即停。"
    ],
    "扫描文本的拼装公式": [
      "取窗口长度：条目自己的扫描深度（为 null 时用全局值 + 补扫偏移）。",
      "起点固定为 0、上界**右开**：窗口=2 取最新两条；窗口 ≤ 0 返回空串（触发「空窗口不命中」）。",
      "整串以**一个哨兵字符**打头，各段之间用「换行 + 哨兵」连接。",
      "然后按条目的六个 match 开关逐项追加：人物设定描述 / 角色描述 / 角色性格 / 角色深度提示 / 场景 / 作者注释。",
      "再追加注入缓冲（有就加）。",
      "最后追加递归缓冲 —— **但补扫轮（最小激活）不加递归缓冲**，注入缓冲则照加。"
    ],
    "为什么要有哨兵字符（必须照抄）": "整词匹配用的判定形如「行首或非词字符 + 关键词 + 行尾或非词字符」。哨兵字符本身是**非词字符**，所以它保证了「关键词出现在消息最开头」也能被整词规则命中。没有它就是漏命中。",
    "匹配原语（唯一的匹配入口）": [
      "第一步先试「形如 `/模式/标志` 的写法」：能解析成正则就**直接测原始文本**，**不做大小写转换、不做整词匹配**（正则的 `/i` 得作者自己写）。",
      "不是正则：两侧同时做大小写归一（大小写敏感关时），然后分两路 ——",
      "  整词匹配开 → 若关键词本身含多个词（含空白）则退化成子串包含；否则用「行首/非词 + 词 + 行尾/非词」的判定。",
      "  整词匹配关 → 纯子串包含。",
      "⇒ 正则关键字**覆盖全局的大小写与整词设置**，这是最容易误解的一条。"
    ],
    "getScore（组评分用的「命中数」）": {
      "定义": "分数 = **命中的关键词条数**（不是 token，不是加权）。",
      "主键部分": "逐个主关键词做匹配，命中一个加 1。主键数为 0 时直接返回 0。",
      "副键部分（仅在副键数 > 0 时）": [
        { "副键逻辑": "AND_ANY", "加权": "`主分 + 副命中数`" },
        { "副键逻辑": "AND_ALL", "加权": "**全部副键命中**时才 `主分 + 副命中数`；否则只 `主分`" },
        { "副键逻辑": "NOT_ALL", "加权": "**恒为 `主分`**（不影响组评分）" },
        { "副键逻辑": "NOT_ANY", "加权": "**恒为 `主分`**（不影响组评分）" }
      ],
      "消费点": "只在组评分阶段被调用（见 worldinfo.group.competition）。"
    },
    "getScore 的真实陷阱": "组评分阶段是**对组内每一条都算分**（含明确声明「不参与评分」的条目），取最高分作为淘汰门槛。⇒ 一个不参与评分的条目若分数最高，会抬高门槛，把其它评分子条目全删掉。这个陷阱必须写进实现里的注释。",
    "易错点": [
      "缓冲不用哨兵字符：消息开头出现的关键词在整词模式下漏命中",
      "窗口上界写成闭区间（窗口=2 取了 3 条）",
      "窗口 ≤ 0 时返回「全部消息」：上游返回空串（于是不命中）",
      "名字前缀在缓冲内部再补一遍（会重复）",
      "补扫轮带上了递归缓冲：上游明确不带",
      "正则关键字还做大小写/整词处理：正则分支提前返回，不过这两道",
      "NOT_ALL / NOT_ANY 也算副键分：它们恒等于主分",
      "组评分门槛只按参与评分的条目算：要按全组算"
    ],
    "pseudocode": "构造缓冲(消息, 全局扫描数据):\n  深度缓冲[i] = 消息[i].trim()      # 调用方已反转且已加好「名字: 」前缀\n\n取扫描文本(条目, 轮次类型):\n  窗口 = 条目.扫描深度 或 (全局扫描深度 + 补扫偏移)\n  若 窗口 <= 0: 返回 空串\n  窗口 = min(窗口, 1000)\n  结果 = 哨兵 + 深度缓冲[0..窗口].用(换行+哨兵)连接\n  若 条目.要人物设定 → 结果 += 换行+哨兵 + 人物设定描述\n  若 条目.要角色描述 → ... 性格 → 深度提示 → 场景 → 作者注释\n  若 注入缓冲非空 → 结果 += 换行+哨兵 + 注入缓冲\n  若 递归缓冲非空 且 轮次 != 补扫轮 → 结果 += 换行+哨兵 + 递归缓冲\n  返回 结果\n\n匹配(文本, 关键词, 条目):\n  若 关键词 能解析成 /模式/标志 → 返回 正则.测试(文本)   # 不做大小写/整词\n  文本, 关键词 = 按大小写设置归一\n  若 整词匹配:\n    若 关键词含多词 → 返回 文本.包含(关键词)\n    否则 → 返回 「行首/非词 + 词 + 行尾/非词」判定\n  否则 → 返回 文本.包含(关键词)\n\n算分(条目):\n  主分 = 主关键词逐个匹配命中的个数\n  若 主关键词数 == 0: 返回 0\n  若 副关键词数 > 0:\n    switch 副键逻辑:\n      AND_ANY → 返回 主分 + 副命中数\n      AND_ALL → 返回 (副命中数 == 副关键词总数) ? 主分+副命中数 : 主分\n      NOT_ALL / NOT_ANY → 返回 主分\n  返回 主分\n"
  },
  "kedai": {
    "status": "differs",
    "evidence": [
      "server-rs/src/parsing/world_book.rs:527-534",
      "server-rs/src/parsing/world_book.rs:541-600",
      "server-rs/src/services/prompt_kit.rs:108-139"
    ],
    "note": "Kedai 的扫描缓冲模型与上游**结构不同**：没有哨兵字符、没有递归缓冲、没有注入缓冲、没有按 match 开关选择性拼接角色字段；扫描池是「按时间从旧到新、剔除 system 的消息列表」，窗口长度只按 **user 消息** 计数（跨度起点 = 倒数第 N 条 user 消息），但匹配池取该跨度内的**全部消息**（含 assistant）。⇒ 「窗口按 user 计数 + 池取全部角色」是 Kedai 自定的口径，与上游「按消息条数取最近 N 条」不同。匹配原语是「正则 or 子串」（`entry_matches_texts`：use_regex 时整条走正则、否则 keys+副键拼成同一 OR 列表做子串/小写包含），**没有整词匹配**、**没有 getScore**。"
  },
  "sources": [
    {
      "kind": "src",
      "name": "ST 源码 world-info.js（扫描缓冲四块文本与构造）",
      "ref": "https://github.com/SillyTavern/SillyTavern/blob/release/public/scripts/world-info.js#L199-L259"
    },
    {
      "kind": "src",
      "name": "ST 源码 world-info.js（扫描文本拼装公式：哨兵、右开窗口、match 开关）",
      "ref": "https://github.com/SillyTavern/SillyTavern/blob/release/public/scripts/world-info.js#L279-L328"
    },
    {
      "kind": "src",
      "name": "ST 源码 world-info.js（匹配原语：正则分支前置、整词与非整词两路）",
      "ref": "https://github.com/SillyTavern/SillyTavern/blob/release/public/scripts/world-info.js#L337-L366"
    },
    {
      "kind": "src",
      "name": "ST 源码 world-info.js（getScore 与四档副键加权）",
      "ref": "https://github.com/SillyTavern/SillyTavern/blob/release/public/scripts/world-info.js#L428-L473"
    },
    {
      "kind": "doc",
      "name": "ST 官方文档 · World Info · Include Names（名字前缀作为扫描文本的一部分）",
      "ref": "https://github.com/SillyTavern/SillyTavern-Docs/blob/main/Usage/worldinfo.md#L349-L368"
    }
  ],
  "related": ["worldinfo.group.competition", "worldinfo.logic.selective", "worldinfo.settings.global"],
  "updated": "2026-10-31"
}
