{
  "id": "regex.engine.chain",
  "domain": "regex",
  "title": "getRegexedString 五道门的执行顺序（顺序本身可观测）",
  "priority": "P0",
  "authority": "src",
  "spec": {
    "为什么 authority 是 src": "官方文档讲的是每个字段「是什么意思」，不讲五道门的先后与短路范围。而顺序决定哪些脚本会跑、debug 日志谁先打印，属于实现级契约。",
    "入参": "原始字符串、placement 数值、以及五个可选标志：角色覆盖、是否聊天显示面、是否组装提示词面、是否编辑态、楼层深度。",
    "五道门（严格按执行顺序）": [
      {
        "门": 0,
        "条件": "原始字符串不是字符串",
        "短路范围": "**整个函数**",
        "动作": "告警并返回**空串**（注意：不是返回原值，数字型入参会被吃掉）"
      },
      {
        "门": 0.5,
        "条件": "这三者任一成立：正则扩展被全局禁用 / 原始字符串为空 / placement 未传",
        "短路范围": "**整个函数**",
        "动作": "原样返回入参，一条脚本都不跑"
      },
      {
        "门": 1,
        "条件": "适用面三分支任一成立：① 脚本的「仅显示」开关 ∧ 本次是显示面；② 脚本的「仅提示词」开关 ∧ 本次是提示词面；③ 两个开关都不勾 ∧ 本次既非显示面也非提示词面",
        "短路范围": "当前脚本",
        "动作": "否则跳过该脚本（不再进入门 2/3/4）"
      },
      {
        "门": 2,
        "条件": "编辑态 ∧ 脚本未勾「编辑时运行」",
        "短路范围": "当前脚本",
        "动作": "跳过"
      },
      {
        "门": 3,
        "条件": "**仅当本次传入了深度数值时**才检查：脚本有有效下限 ∧ 深度 < 下限 → 跳过；脚本有有效上限 ∧ 深度 > 上限 → 跳过",
        "短路范围": "当前脚本",
        "动作": "跳过",
        "关键": "深度参数不是数值时**整段检查被跳过**（不是「视为 0」）"
      },
      {
        "门": 4,
        "条件": "脚本的 placement 数组包含本次 placement",
        "短路范围": "当前脚本",
        "动作": "才真正执行替换（该门**放在最后**）"
      }
    ],
    "有效性的判定细则（门 3）": [
      "下限有效性：不是 NaN、不是 null、且 >= -1。⇒ **-1 是合法值**，含义是「不限（含 Continue 的最后一条）」",
      "上限有效性：不是 NaN、不是 null、且 >= 0。⇒ 负值与 NaN 都表示不限",
      "输入框留空经整数解析得到 NaN ⇒ 不限。"
    ],
    "门 1 的第三支最反直觉": "「两个 only 都不勾」不等于「所有情况都跑」：它只在**源改写阶段**（改聊天记录本身、两个面标志都不传）跑；在聊天显示或组装提示词时会被跳过。理由（源码注释意）：源头已经在更早阶段改过了。",
    "脚本来源与级联顺序": {
      "三类来源": "全局脚本 / 预设内嵌脚本 / 角色卡内嵌脚本。后两类需要用户显式授权，未授权时整体视为空。",
      "级联顺序": "合并顺序**由枚举声明顺序决定，不是数值大小**，实际恒为「全局 → 预设 → 角色卡」。同一段文本会被三个桶按此顺序**级联改写**——后一桶看到的是前一桶改完的文本。",
      "陷阱": "把三类重新排序会静默改变最终文本（例如卡内脚本与全局脚本同时命中同一处时，谁先改谁赢）。"
    },
    "禁用位置": "「脚本被停用」在替换函数内部判定（提交判断），不在五道门里。⇒ 停用的脚本仍会逐条过完五道门，只是最后不产生替换。",
    "易错点": [
      "把门 4（placement）提前判：功能等价但短路与日志顺序变了，排障口径不同",
      "把门 1 写成「三个条件取与」：语义完全错",
      "深度未传时按 0 处理：会误杀/误放一批脚本",
      "把「两个 only 都不勾」当成 all：显示面和提示词面都会多跑一遍",
      "非字符串入参返回原值：ST 返回空串"
    ],
    "pseudocode": "若 入参 非字符串 → 告警, 输出空串\n若 扩展被全局禁用 或 入参为空 或 placement 未传 → 输出入参\nfor 脚本 in 全部脚本(全局→预设→角色卡):\n  若 非 ( (仅显示 ∧ 显示面) ∨ (仅提示词 ∧ 提示词面) ∨ (两都不勾 ∧ 非显示 ∧ 非提示词) ): 跳过\n  若 编辑态 ∧ 未勾编辑时运行: 跳过\n  若 传入了深度数值:\n    若 下限有效 ∧ 下限 >= -1 ∧ 深度 < 下限: 跳过\n    若 上限有效 ∧ 上限 >= 0 ∧ 深度 > 上限: 跳过\n  若 脚本.placement 不包含 placement: 跳过\n  输出 = 执行替换(脚本, 输出)\n输出 输出\n"
  },
  "kedai": {
    "status": "missing",
    "evidence": [
      "server-rs/src/parsing/regex_script.rs:169-186",
      "web/src/render.ts:381-386",
      "web/src/render.ts:391-413",
      "web/src/render.ts:597-611"
    ],
    "note": "Kedai 没有五道门这套链路：只有两处按 markdown_only 分流的渲染期替换（渲染脚本路径 + 隐藏类脚本路径），加一个楼层深度过滤函数；没有「适用面三支 OR」「编辑态」「placement」三道门，也没有固定级联顺序（脚本按数组顺序、且在渲染前对脚本做了重排）。深度过滤的判定与 ST 门 3 形状相近（未传深度即不过滤），但 Kedai 的深度类型是可空数字而 ST 是「非数值即跳过整段检查」，边界略有不同。"
  },
  "sources": [
    {
      "kind": "src",
      "name": "ST 源码 regex 扩展 engine.js（getRegexedString 五道门全文）",
      "ref": "https://github.com/SillyTavern/SillyTavern/blob/release/public/scripts/extensions/regex/engine.js#L334-L381"
    },
    {
      "kind": "src",
      "name": "ST 源码 regex 扩展 engine.js（三桶合并顺序）",
      "ref": "https://github.com/SillyTavern/SillyTavern/blob/release/public/scripts/extensions/regex/engine.js#L98-L133"
    },
    {
      "kind": "src",
      "name": "ST 源码 regex 扩展 engine.js（停用判定在替换函数内）",
      "ref": "https://github.com/SillyTavern/SillyTavern/blob/release/public/scripts/extensions/regex/engine.js#L388-L395"
    },
    {
      "kind": "src",
      "name": "ST 源码 script.js（各调用点传入的 flags 与 placement）",
      "ref": "https://github.com/SillyTavern/SillyTavern/blob/release/public/script.js#L4501-L4508"
    }
  ],
  "related": ["regex.placement.constants", "regex.only.matrix", "regex.substitute.modes"],
  "updated": "2026-10-31"
}
